{
    "$schema": "http://json-schema.org/draft-07/schema#",
    "description": "Schema for record. file type *.rec.json",
    "required": [
        "name",
        "fields"
    ],
    "additionalProperties": false,
    "properties": {
        "name": {
            "type": "string"
        },
        "description": {
            "type": "string"
        },
        "nameInDb": {
            "type": "string"
        },
        "customValidation": {
            "type": "string"
        },
        "useTimestampCheck": {
            "type": "boolean"
        },
        "operations": {
            "type": "array",
            "items": {
                "type": "string",
                "enum": [
                    "get",
                    "create",
                    "update",
                    "filter",
                    "delete"
                ]
            }
        },
        "fields": {
            "type": "array",
            "items": {
                "type": "object",
                "required": [
                    "name",
                    "dataType"
                ],
                "properties": {
                    "name": {
                        "type": "string"
                    },
                    "dataType": {
                        "type": "string",
                        "enum": [
                            "accountStatus",
                            "bool",
                            "code",
                            "country",
                            "date",
                            "desc",
                            "email",
                            "flexibleId",
                            "govtCode",
                            "id",
                            "ip",
                            "json",
                            "loginId",
                            "money",
                            "name",
                            "integer",
                            "phone",
                            "pin",
                            "state",
                            "tenantKey",
                            "text",
                            "timestamp",
                            "uniqueId",
                            "url",
                            "userType",
                            "gender",
                            "income",
                            "marks",
                            "marksOrAb",
                            "valuationType",
                            "internalMarks"
                        ]
                    },
                    "defaultValue": {
                        "type": "string"
                    },
                    "dbColumnName": {
                        "type": "string"
                    },
                    "fieldType": {
                        "type": "string",
                        "enum": [
                            "generatedPrimaryKey",
                            "primaryKey",
                            "tenantKey",
                            "createdBy",
                            "createdAt",
                            "modifiedBy",
                            "modifiedAt",
                            "requiredData",
                            "optionalData"
                        ]
                    },
                    "label": {
                        "type": "string"
                    },
                    "icon": {
                        "type": "string"
                    },
                    "fieldPrefix": {
                        "type": "string"
                    },
                    "fieldSuffix": {
                        "type": "string"
                    },
                    "hint": {
                        "type": "string"
                    },
                    "placeHolder": {
                        "type": "string"
                    },
                    "listName": {
                        "type": "string"
                    },
                    "listKey": {
                        "type": "string"
                    },
                    "errorId":{
                        "type": "string"
                    },
                    "renderInList":{
                        "type": "boolean"
                    },
                    "renderInSave":{
                        "type": "boolean"
                    }
                },
                "additionalProperties": false
            }
        },
        "fromToPairs": {
            "type": "array",
            "items": {
                "type": "object",
                "required": [
                    "field1",
                    "field2"
                ],
                "properties": {
                    "field1": {
                        "type": "string"
                    },
                    "field2": {
                        "type": "string"
                    },
                    "equalOk": {
                        "type": "boolean"
                    },
                    "errorId": {
                        "type": "string"
                    }
                },
                "additionalProperties": false
            }
        },
        "inclusivePairs": {
            "type": "array",
            "items": {
                "type": "object",
                "required": [
                    "field1",
                    "field2"
                ],
                "properties": {
                    "field1": {
                        "type": "string"
                    },
                    "field2": {
                        "type": "string"
                    },
                    "value1": {
                        "type": "string"
                    },
                    "errorId": {
                        "type": "string"
                    }
                },
                "additionalProperties": false
            }
        },
        "exclusivePairs": {
            "type": "array",
            "items": {
                "type": "object",
                "required": [
                    "field1",
                    "field2"
                ],
                "properties": {
                    "field1": {
                        "type": "string"
                    },
                    "field2": {
                        "type": "string"
                    },
                    "isRequired": {
                        "type": "boolean"
                    },
                    "errorId": {
                        "type": "string"
                    }
                },
                "additionalProperties": false
            }
        }
    }
}
