{
    "name": "student",
    "nameInDb": "students",
    "operations":["create","update","filter","get"],
    "fields": [
        {
            "name": "studentId",
            "dataType": "flexibleId",
            "dbColumnName": "student_id",
            "fieldType": "generatedPrimaryKey"
        },
        {
            "name": "name",
            "dataType": "name",
            "dbColumnName": "name",
            "fieldType": "requiredData"
        },
        {
            "name": "email",
            "dataType": "email",
            "dbColumnName": "email",
            "fieldType": "requiredData"
        }
    ]
}
