{
    "name": "employee",
    "nameInDb": "employees",
    "operations":["create","update","filter","get"],
    "fields": [
        {
            "name": "employeeId",
            "dataType": "flexibleId",
            "dbColumnName": "employee_id",
            "fieldType": "generatedPrimaryKey"
        },
        {
            "name": "name",
            "dataType": "name",
            "dbColumnName": "name",
            "fieldType": "requiredData"
        },
        {
            "name": "email",
            "dataType": "email",
            "dbColumnName": "email",
            "fieldType": "requiredData"
        },
        {
            "name": "gender",
            "dataType": "text",
            "dbColumnName": "gender",
            "fieldType": "requiredData",
            "listName":"gender"
        },
        {
            "name": "phone",
            "dataType": "phone",
            "dbColumnName": "phone_number",
            "fieldType": "optionalData"
        }
    ]
}
